{"test_substance":"Paracetamol","cell_type":"HepG2","probes":["ARL13B_13111","F5_24874","SUMO1_6890","ACHE_13991","CCDC77_22062"],"counts":[[144,180,174,181,219,266,156,444,438,290,501,642,587,879,96,178,285,45,192,138,242,464,457,462,407,525,622,433,265,292,339,256,381,332,273,224,205,160,524,507,372,242,228,145,492,549,459,205,223,176,476,525,426,207,220,152,562,493,495,286,276,175,525,456,388,216,198,124,549,554,478,216,176,166,495,275,463,210,191,98,73,119,82,187,134,72,158,163,107,158,139,161,227,297,91,199,157,168,204,102,253,265,165,177,191,189,113,171,92,202,161,129,194,141,126,147,176,100,192,245,120,228,179,269,264,134,280,296,276,271,275,186,334,392,334,258,307,184,227,370,288,350,251,192,328,416,388,244,252,168,277,346,320,272,195,229,291,298,246,409,471,336,100,150,75,395,216,454,162,261,126,428,460,454,220,309,166,316,342,373,190,256,228,277,306,220,227,243,295,320,362,447,139,274,126,94,289,451,144,188,208,252,191,153,395,489,398,219,249,149,441,519,393,237,259,101,504,463,425,220,211,63,450,402,381,250,302,70,363,472,486,210,188,128,454,534,457,176,221,153,447,469,435],[66,65,74,42,64,123,30,118,49,129,141,145,137,120,43,90,78,20,55,50,24,93,114,95,75,94,113,36,78,60,105,61,80,102,62,63,41,32,139,119,153,59,61,34,129,103,89,75,53,46,131,91,125,41,56,13,46,107,142,56,58,21,137,94,97,48,56,35,151,103,147,56,14,35,140,68,116,71,37,45,29,35,40,56,41,11,62,109,82,69,58,52,77,90,59,66,31,44,49,43,88,87,72,48,64,74,39,54,14,60,81,63,73,49,50,76,63,37,79,50,25,53,25,41,77,29,69,66,71,43,68,10,72,71,52,37,68,35,62,63,77,126,75,16,87,79,46,81,54,6,65,94,61,90,31,44,79,78,55,114,128,84,40,38,52,140,167,128,51,96,27,160,126,124,84,94,71,144,119,164,60,63,58,138,87,114,83,88,84,81,127,160,26,70,61,86,102,124,96,40,72,56,44,28,74,116,64,41,33,25,97,109,99,55,56,12,125,98,103,41,50,10,130,83,81,53,51,4,90,113,86,41,43,19,137,111,90,34,37,19,97,79,86],[101,238,156,178,156,175,78,358,338,107,313,461,391,377,93,126,125,181,94,165,51,355,425,425,319,435,557,171,177,297,233,203,200,270,128,230,162,128,355,516,156,223,177,122,405,394,329,180,172,137,362,518,193,213,144,138,282,429,340,240,309,163,357,439,247,183,142,128,491,425,424,176,160,131,417,291,283,129,152,66,81,141,68,184,150,51,195,191,143,133,128,130,235,238,70,164,79,197,194,147,241,187,92,114,158,225,119,160,122,180,240,201,123,165,95,144,249,216,146,220,56,193,166,252,230,125,217,402,297,266,237,148,390,375,356,306,250,133,198,411,207,334,324,187,340,435,434,302,269,98,271,313,364,196,204,209,241,310,268,242,345,671,87,105,72,218,332,416,190,196,105,399,265,346,93,308,99,393,244,246,175,285,205,488,373,306,172,365,275,174,523,352,174,212,164,165,359,223,147,252,237,226,209,151,519,416,481,235,188,98,520,487,375,160,216,113,381,409,432,228,252,104,356,404,421,256,305,43,317,420,474,168,123,138,334,577,466,146,207,171,525,350,376],[1,4,3,0,0,4,5,5,4,6,4,17,6,34,7,4,3,0,3,7,13,9,6,13,9,10,14,39,2,9,4,8,8,13,10,2,2,2,3,7,6,4,4,2,5,2,4,0,1,1,10,16,8,8,4,5,6,11,6,6,3,2,2,1,5,11,6,3,10,8,0,0,1,3,4,0,2,6,1,1,4,0,0,2,2,0,3,5,5,3,0,0,2,3,9,5,1,1,6,1,3,8,2,10,9,5,0,0,4,2,5,8,2,0,1,4,0,2,0,3,5,2,0,4,0,0,3,1,6,0,6,1,4,9,7,11,0,0,11,3,1,6,0,0,17,11,6,0,4,0,3,10,2,1,0,4,8,2,7,8,6,0,0,4,0,15,13,11,7,5,0,12,15,21,6,6,4,0,3,11,11,6,2,5,9,0,10,0,3,8,5,11,0,7,0,0,0,5,8,0,6,6,2,1,7,12,0,1,2,0,2,1,3,0,5,4,3,7,7,5,5,0,11,4,4,2,1,1,11,1,9,4,0,3,2,1,7,4,8,6,4,0,2],[374,530,766,482,578,693,265,833,402,779,935,1114,1138,1377,310,605,802,182,805,451,429,717,899,788,995,1220,1308,602,611,669,862,689,847,916,497,369,299,283,928,795,528,399,423,202,765,746,483,313,356,266,996,925,721,341,331,221,712,854,580,433,561,157,839,768,550,303,354,187,866,788,495,324,183,228,773,272,395,338,222,155,144,125,135,315,309,212,326,421,219,280,288,272,624,627,426,410,204,426,356,211,519,446,280,470,711,428,227,339,118,492,333,214,288,344,218,325,291,137,218,335,250,330,248,474,434,189,623,656,460,348,309,141,751,775,719,399,368,196,454,663,430,827,220,116,830,823,666,506,649,116,615,582,475,431,219,383,520,539,344,1083,1315,339,357,401,164,1022,577,604,219,690,167,767,1174,994,714,791,550,505,860,989,613,342,438,425,430,562,708,416,524,807,537,1227,217,665,253,274,589,904,235,237,338,462,404,303,489,925,273,441,399,238,861,748,475,446,504,74,1007,740,745,493,440,86,801,909,479,507,522,78,835,648,684,371,333,232,872,883,533,319,359,277,882,553,455]],"batch_index":[1,1,1,1,1,1,1,2,2,2,2,2,2,2,3,3,3,3,3,3,3,4,4,4,4,4,4,4,5,5,5,5,5,5,5,2,2,2,2,2,2,2,2,2,2,2,2,2,2,2,2,2,2,2,2,2,2,2,2,2,2,2,2,2,2,2,2,2,2,2,2,2,2,2,2,2,2,1,1,1,1,1,1,1,1,1,1,1,1,1,1,1,1,1,1,1,1,1,1,1,1,1,1,1,1,1,1,1,1,1,1,1,1,1,1,1,1,1,5,5,5,5,5,5,5,5,5,5,5,5,5,5,5,5,5,5,5,5,5,5,5,5,5,5,5,5,5,5,5,5,5,5,5,5,5,5,5,5,5,3,3,3,3,3,3,3,3,3,3,3,3,3,3,3,3,3,3,3,3,3,3,3,3,3,3,3,3,3,3,3,3,3,3,3,3,3,3,3,3,3,3,4,4,4,4,4,4,4,4,4,4,4,4,4,4,4,4,4,4,4,4,4,4,4,4,4,4,4,4,4,4,4,4,4,4,4,4,4,4,4,4,4,4],"concentration":[0.64,3.2,16.0,80.0,400.0,2000.0,10000.0,0.64,3.2,16.0,80.0,400.0,2000.0,10000.0,0.64,3.2,16.0,80.0,400.0,2000.0,10000.0,0.64,3.2,16.0,80.0,400.0,2000.0,10000.0,0.64,3.2,16.0,80.0,400.0,2000.0,10000.0,0.0,0.0,0.0,0.0,0.0,0.0,0.0,0.0,0.0,0.0,0.0,0.0,0.0,0.0,0.0,0.0,0.0,0.0,0.0,0.0,0.0,0.0,0.0,0.0,0.0,0.0,0.0,0.0,0.0,0.0,0.0,0.0,0.0,0.0,0.0,0.0,0.0,0.0,0.0,0.0,0.0,0.0,0.0,0.0,0.0,0.0,0.0,0.0,0.0,0.0,0.0,0.0,0.0,0.0,0.0,0.0,0.0,0.0,0.0,0.0,0.0,0.0,0.0,0.0,0.0,0.0,0.0,0.0,0.0,0.0,0.0,0.0,0.0,0.0,0.0,0.0,0.0,0.0,0.0,0.0,0.0,0.0,0.0,0.0,0.0,0.0,0.0,0.0,0.0,0.0,0.0,0.0,0.0,0.0,0.0,0.0,0.0,0.0,0.0,0.0,0.0,0.0,0.0,0.0,0.0,0.0,0.0,0.0,0.0,0.0,0.0,0.0,0.0,0.0,0.0,0.0,0.0,0.0,0.0,0.0,0.0,0.0,0.0,0.0,0.0,0.0,0.0,0.0,0.0,0.0,0.0,0.0,0.0,0.0,0.0,0.0,0.0,0.0,0.0,0.0,0.0,0.0,0.0,0.0,0.0,0.0,0.0,0.0,0.0,0.0,0.0,0.0,0.0,0.0,0.0,0.0,0.0,0.0,0.0,0.0,0.0,0.0,0.0,0.0,0.0,0.0,0.0,0.0,0.0,0.0,0.0,0.0,0.0,0.0,0.0,0.0,0.0,0.0,0.0,0.0,0.0,0.0,0.0,0.0,0.0,0.0,0.0,0.0,0.0,0.0,0.0,0.0,0.0,0.0,0.0,0.0,0.0,0.0,0.0,0.0,0.0,0.0,0.0,0.0,0.0,0.0,0.0,0.0],"n_treatment_batch":5}