{"test_substance":"Nitrofurantoin","cell_type":"HepG2","probes":["MPDU1_11661","OAS3_90233","TMEM183A_34069","CEP89_11010","ACBD3_59"],"counts":[[263,310,319,438,202,255,35,298,300,401,319,247,188,26,210,84,361,323,352,243,34,298,281,452,322,336,243,41,386,438,549,441,460,271,86,341,256,171,579,685,680,294,250,209,659,656,576,303,289,205,736,643,614,253,303,166,661,540,530,368,333,211,735,638,678,247,226,165,649,650,669,284,203,180,621,312,518,368,224,184,208,214,195,270,313,153,387,516,417,309,226,190,422,525,356,310,197,340,417,387,342,364,223,465,586,489,257,285,164,378,454,340,267,275,190,396,485,329,266,413,256,268,219,339,488,322,460,446,421,452,488,296,407,541,346,420,461,266,416,398,374,580,317,259,565,583,357,535,433,242,439,508,310,608,290,231,378,505,356,546,655,593,170,208,248,588,886,904,353,430,392,781,683,691,312,434,280,978,525,646,331,535,311,698,718,753,423,606,425,528,727,665,280,415,362,564,586,623,384,393,285,292,241,172,623,624,617,268,285,165,635,571,499,276,258,121,584,573,651,235,235,54,560,502,572,360,292,98,620,578,532,255,204,137,610,646,548,263,234,192,631,525,570],[17,104,78,69,18,54,15,41,30,53,26,42,28,0,35,0,22,12,34,27,0,31,30,53,31,66,45,7,71,38,90,61,30,85,9,47,34,14,83,75,78,21,27,24,80,88,59,39,28,24,81,49,76,39,32,24,65,94,70,51,37,19,64,62,85,34,42,17,99,75,68,33,22,22,86,13,44,44,47,20,26,19,27,46,41,21,46,67,37,39,27,15,43,74,53,43,21,34,26,28,69,43,38,60,91,55,37,35,6,60,29,61,45,34,24,25,35,28,31,32,18,26,27,46,29,9,66,58,58,22,23,11,52,54,58,42,41,11,52,52,77,48,24,15,55,71,64,55,28,9,42,75,39,32,0,30,35,43,41,138,91,30,47,49,40,185,37,78,51,81,38,106,124,95,55,78,85,99,120,169,72,51,56,78,58,136,98,56,59,214,32,134,24,63,50,62,82,136,50,41,42,30,29,22,56,79,21,36,20,15,92,86,71,25,32,10,87,45,72,35,28,4,45,63,63,31,46,0,65,45,63,25,24,19,71,71,78,15,28,23,75,73,58],[117,187,174,220,135,159,41,129,168,204,136,155,58,0,118,42,136,120,106,115,0,202,188,290,224,265,118,28,196,181,356,241,210,132,41,107,71,68,312,155,271,94,92,55,340,233,203,124,99,59,401,223,318,93,95,48,289,207,247,173,136,56,282,169,268,123,97,50,365,180,275,117,63,48,243,124,237,194,129,97,87,84,111,161,153,16,147,258,160,134,106,76,160,240,167,199,97,167,170,131,226,180,146,163,283,228,83,127,68,165,155,128,129,126,118,183,181,173,30,79,83,111,93,78,150,120,233,238,235,170,145,66,249,283,228,136,135,83,210,226,168,261,102,57,316,317,171,145,178,49,257,196,184,139,127,90,184,204,131,426,408,260,144,150,116,340,378,297,238,302,232,351,460,370,213,285,203,421,306,375,230,211,234,256,244,402,312,306,298,402,391,404,154,247,176,269,365,346,186,222,195,192,149,74,298,359,293,213,155,79,333,407,325,290,117,67,443,304,346,214,120,19,397,378,254,206,209,45,531,382,320,241,127,45,523,236,330,163,71,54,345,353,289],[75,240,140,109,61,150,21,53,56,58,62,59,24,10,55,0,32,23,52,41,17,36,37,81,40,61,65,6,58,58,99,85,84,82,16,53,27,31,102,80,93,45,44,26,98,87,85,44,52,28,112,68,118,41,42,15,100,82,92,68,59,11,100,78,80,32,44,23,124,95,84,33,24,32,101,0,76,67,33,41,47,61,43,51,63,60,81,83,88,63,49,29,78,113,164,66,34,84,47,67,59,68,44,162,173,97,26,57,30,93,76,69,45,48,40,81,73,20,29,44,49,36,18,36,56,29,84,99,66,28,55,28,79,85,75,32,44,25,72,87,63,97,34,6,95,123,58,84,73,12,75,84,51,80,38,31,73,70,45,295,200,54,63,61,65,295,157,115,109,147,63,124,224,168,133,165,194,134,252,325,139,80,92,155,87,203,143,94,97,356,96,232,137,161,81,66,207,177,63,97,89,51,40,27,20,126,85,47,31,17,82,98,75,47,52,2,159,85,65,66,29,18,100,98,70,58,55,8,119,81,73,49,44,12,126,110,94,45,40,18,99,59,67],[79,141,153,249,64,159,39,180,219,263,158,167,119,17,86,10,163,62,160,185,11,154,178,276,209,199,209,60,270,306,382,264,291,222,82,192,93,87,300,315,274,144,151,81,371,327,273,162,131,98,431,359,363,176,152,65,404,328,283,216,174,75,341,325,360,131,99,46,372,375,339,140,96,83,337,62,287,217,161,85,81,71,84,191,155,147,213,232,155,181,142,99,264,253,188,233,103,197,170,149,271,211,133,223,215,242,140,188,82,215,171,217,182,194,125,151,205,129,127,128,96,152,115,150,230,81,269,266,320,243,206,115,304,295,264,154,191,74,248,278,243,313,190,67,324,353,276,249,230,25,205,267,212,286,48,111,199,267,225,252,380,176,97,116,97,301,320,408,99,205,199,365,381,332,214,255,170,291,285,314,208,262,208,233,181,218,273,265,316,266,339,297,103,177,195,127,305,268,138,159,201,173,161,126,284,386,195,194,139,96,382,361,297,187,164,30,328,300,360,173,172,27,341,327,268,204,198,0,344,402,378,142,165,84,413,363,354,141,131,121,433,343,239]],"batch_index":[1,1,1,1,1,1,1,2,2,2,2,2,2,2,3,3,3,3,3,3,3,4,4,4,4,4,4,4,5,5,5,5,5,5,5,2,2,2,2,2,2,2,2,2,2,2,2,2,2,2,2,2,2,2,2,2,2,2,2,2,2,2,2,2,2,2,2,2,2,2,2,2,2,2,2,2,2,1,1,1,1,1,1,1,1,1,1,1,1,1,1,1,1,1,1,1,1,1,1,1,1,1,1,1,1,1,1,1,1,1,1,1,1,1,1,1,1,1,5,5,5,5,5,5,5,5,5,5,5,5,5,5,5,5,5,5,5,5,5,5,5,5,5,5,5,5,5,5,5,5,5,5,5,5,5,5,5,5,5,3,3,3,3,3,3,3,3,3,3,3,3,3,3,3,3,3,3,3,3,3,3,3,3,3,3,3,3,3,3,3,3,3,3,3,3,3,3,3,3,3,3,4,4,4,4,4,4,4,4,4,4,4,4,4,4,4,4,4,4,4,4,4,4,4,4,4,4,4,4,4,4,4,4,4,4,4,4,4,4,4,4,4,4],"concentration":[0.0192,0.096,0.48,2.4,12.0,60.0,300.0,0.0192,0.096,0.48,2.4,12.0,60.0,300.0,0.0192,0.096,0.48,2.4,12.0,60.0,300.0,0.0192,0.096,0.48,2.4,12.0,60.0,300.0,0.0192,0.096,0.48,2.4,12.0,60.0,300.0,0.0,0.0,0.0,0.0,0.0,0.0,0.0,0.0,0.0,0.0,0.0,0.0,0.0,0.0,0.0,0.0,0.0,0.0,0.0,0.0,0.0,0.0,0.0,0.0,0.0,0.0,0.0,0.0,0.0,0.0,0.0,0.0,0.0,0.0,0.0,0.0,0.0,0.0,0.0,0.0,0.0,0.0,0.0,0.0,0.0,0.0,0.0,0.0,0.0,0.0,0.0,0.0,0.0,0.0,0.0,0.0,0.0,0.0,0.0,0.0,0.0,0.0,0.0,0.0,0.0,0.0,0.0,0.0,0.0,0.0,0.0,0.0,0.0,0.0,0.0,0.0,0.0,0.0,0.0,0.0,0.0,0.0,0.0,0.0,0.0,0.0,0.0,0.0,0.0,0.0,0.0,0.0,0.0,0.0,0.0,0.0,0.0,0.0,0.0,0.0,0.0,0.0,0.0,0.0,0.0,0.0,0.0,0.0,0.0,0.0,0.0,0.0,0.0,0.0,0.0,0.0,0.0,0.0,0.0,0.0,0.0,0.0,0.0,0.0,0.0,0.0,0.0,0.0,0.0,0.0,0.0,0.0,0.0,0.0,0.0,0.0,0.0,0.0,0.0,0.0,0.0,0.0,0.0,0.0,0.0,0.0,0.0,0.0,0.0,0.0,0.0,0.0,0.0,0.0,0.0,0.0,0.0,0.0,0.0,0.0,0.0,0.0,0.0,0.0,0.0,0.0,0.0,0.0,0.0,0.0,0.0,0.0,0.0,0.0,0.0,0.0,0.0,0.0,0.0,0.0,0.0,0.0,0.0,0.0,0.0,0.0,0.0,0.0,0.0,0.0,0.0,0.0,0.0,0.0,0.0,0.0,0.0,0.0,0.0,0.0,0.0,0.0,0.0,0.0,0.0,0.0,0.0,0.0],"n_treatment_batch":5}